{
  "schema_version": "1.0.0",
  "practice_placement_id": "risk-return-practice-placement",
  "resource_id": "additional-review",
  "resource_version": "1.1.0",
  "resource_digest": "dddddddddddddddddddddddddddddddddddddddddddddddddddddddddddddddd",
  "resource_title": "Additional review",
  "state": "unavailable",
  "unavailable_reason": "mapping_not_found"
}
